rootId:ID,root,transliteration,:LABEL,descriptionTr,descriptionEn,translationTr,translationEn
1,"سمو","smw","Root","yüce/yüksek olmak, yükseltilmiş, çatı, tavan; isim, sıfat, nitelik; semavat - yükseklikler/gökler/yağmur, yağmur bulutları. ism - Bir şeyin/nesnenin ayırt edici işareti <br><br><strong>Türkçe’ye girmiş türevler : </strong>sema, semavat, alaimsema, isim, bismillah (besmele), esami, esma, tesmiye (müsemma)","To be noble/high, elevated, roof, ceiling; name, adjective, quality; semavat - heights/skies/rain, rain clouds. ism - A distinguishing mark of a thing/object.","gök","names"
2,"رحم","rHm","Root","merhamet etmek, şefkat göstermek, severek ve acıyarak korumak. Yufka yürekli olmak, acımak, birinin üzüntüsüne ortak olmak. Acınacak durumda bulunan kimseye yönelik yufka yüreklilik ve şefkat. Lütufta bulunma.","To show mercy, to demonstrate compassion, to protect with love and pity. To be tender-hearted, to feel pity, to empathize with someone's sorrow. Kindness and compassion towards someone in a pitiable condition. To bestow favor.","Rahim","Mercy"
3,"حمد","Hmd","Root","Birini övmek veya yüceltmek veya takdir etmek, birisinden olumlu olarak bahsetmek, bir şeyi onaylamak, birine hakkını ödemek/vermek, övgüye değer veya takdire şayan olmak.","To praise or eulogize or commend someone, speak well of someone, mention someone with approbation, approve of a thing, recompense/pay someone his due, to be praiseworthy or commendable.","hamd","Praise"
4,"ربب","rbb","Root","Usta ve efendi olan, toparlayan, bir araya getiren, sahip olan/elinde tutan, kural, yükseltmek, yetiştirmek, korumak, şef, gardiyan, düzenleyen, belirleyen, bekçi, sağlayan, esirgeyen, koruyan, mükemmelleştiren, ödüllendiren, yaratan, sürdüren, özellikleri yeniden düzenleyen, geliştiren, büyümenin kural ve kanunlarını belirleyen, bir şeyi tamamlanma hedefine ulaşıncaya kadar birbirini takip eden en uygun koşullarlarla karşı karşıya getirerek teşvik eden, derece derece tamamlanmaya doğru götüren, kim ki bir şeye sahip olur onun rabbidir. <br><br><strong>Türkçe’ye girmiş türevler : </strong>erbap, rabbena, rabbi, terbiye, murabba, mürebbi, mürebbiye, rabbani, rabbi, rabbülalemin, yarabbi <br> <br>~ Aram rab, rabbā רַב/רַבָּא 1. büyük (sıfat), 2. ulu kişi, efendi < Aram #rb רב büyük olma, artma, büyüme = Akad rabū büyük","The root ""ر ب ب"" (R-B-B) in Arabic is fundamentally significant, embodying concepts of growth, development, and lordship. This triliteral root appears in various forms throughout the Arabic language, most notably in the Quran, and carries a wide range of meanings depending on the context in which it is used.
<br><br>
At its core, the root R-B-B conveys the idea of nurturing, sustaining, and developing something from one stage to another, ensuring its growth and maturity. It's often associated with care and guardianship, highlighting a process of progressive development.
<br><br>
In a religious context, this root is commonly associated with God, denoting His role as the Lord, Sustainer, and Cherisher of the Universe. The term ""رب"" (Rabb) is frequently used in the Quran to refer to God's sovereignty, mercy, and providential care over all creation. It emphasizes God's relationship with the creation as the ultimate nurturer and sustainer, guiding it through all stages of existence.
<br><br>
Moreover, the root R-B-B is not limited to divine lordship. It can also refer to human guardianship or stewardship over something, such as a person being responsible for the care and upbringing of a child, or oversight over property and affairs. In this sense, it underscores the notion of responsibility and authority exercised with care and wisdom.
<br><br>
The linguistic versatility of the root R-B-B allows it to be used in various derivative forms, including nouns, verbs, and adjectives, each reflecting nuances of care, growth, and lordship. For example, ""تربية"" (Tarbiyah) derives from the same root, meaning education or upbringing, emphasizing the developmental aspect of nurturing a person's physical, moral, and intellectual growth.
<br><br>
This root's appearance across different contexts in Arabic literature and the Quran showcases its depth and breadth, encapsulating a comprehensive view of care, growth, and sovereignty intertwined with the fabric of existence.","Rab","Lord"
5,"علم","Elm","Root","İşaretlemek / imzalamak / ayırt etmek, yaratılmışlar / varlıklar, dünya, bilim / öğrenme / bilgi / enformasyon, farkındalık / bilmek. Dünyanın ve yarattıklarının üzerindeki belirtilerden dolayı Yaratanı bilmek. <strong>alim (çoğul. ulema)</strong> - iyi bilen, öğrenen/bilge kimse. <br><br><strong>Türkçe’ye girmiş türevler : </strong>ilim, alem, âlem, âlemci, bezmiâlem, harcıâlem, alim (ulema), alimallah, allame, allem kallem, ilam, ilmihal, ilmühaber, malum, talim (muallim), muallime, ulum, ilmen, ilmi, ilmiyat, ilmiye, malumat, malumatfüruş, talimat, talimatname","","ilim","know"
6,"ملك","mlk","Root","to rule/command/reign, be capable, to control, power/authority, king, kingdom.","","mülk","Owner"
7,"يوم","ywm","Root","Gün, dönem, periyot, zaman, bugün, bu / şu gün, çağ/zaman periyodu, güneşin belli bir noktaya kadar yükseliş süreci, kaza veya olay.. <br><br><strong>Türkçe’ye girmiş türevler : </strong>yevm, eyyam, eyyamcı, yevmiye, yevmiyeci<br><br> Aram yūmā יומא = İbr yōm יום = Akad ūmu = gün","","gün","Day"
8,"دين","dyn","Root","obedience/submissiveness, servility, religion, high/elevated/noble/glorious rank/condition/state, took/receive a loan or borrowed upon credit, become indebted, in debt, under the obligation of a debt, contract a debt, repay/reimburse a loan, rule/govern/manage it, possess/own it, become habituated/accustomed to something, confirmation, death (because it is a debt everyone must pay), a particular law/statute, system, custom/habit/business, a way/course/manner of conduct/acting, repayment/compensation.","","din","the law"
9,"عبد","Ebd","Root","hizmet etmek, ibadet etmek, tapmak, bir şey etkisini kabul etmek, teslimiyetle veya tevazu ile itaat etmek, onaylamak, uygulamak, adamak, itaat etmek, köle, kontrol altına almak, bir araya getirmek, esir etmek","","kul","slave"
10,"عون","Ewn","Root","to be of middle age. yu'inu (vb. 4) - to aid/assist/help. ta'awana (vb. 4) - to help one another. ista'ana (vb. 10) - to implore for help, seek aid, turn and call for assistance. musta'an - one whose help is to be implored.","","orta yaşlı","Seek help"
11,"هدي","hdy","Root","to guide/direct to the way, take/follow right way/course, rightly guided/directed, a way/course/method/mode/manner of conduct. Gift.","","iletir","guide"
12,"صرط","SrT","Root","a path which is even, wide enough and can be trodden without difficulty. A road/way/path, long sword.","","yol","path"
13,"قوم","qwm","Root","Kıpırdamadan veya sağlam duran, yükselmiş / ayakta, yönetti / yürüttü / sıraya koydu / düzenledi / kurallara bağladı / nezaret etti, kurdu, düz / doğrultmak, korumak / dik tutmak / gözlemlemek / yapmak, insan / topluluk / şirket kurmak, mesken, endam / saygınlık / rütbe. <strong>aqama</strong> - bir şeyi veya meseleyi doğru bir şekilde korumak, devam ettirmek. <br><br><strong>Türkçe’ye girmiş türevler : </strong>kavim, kavmi, kavmiyet, akvam, kamet, ikame (ikamet), istikamet (müstakim), kaim (kaymakam), kaime, kavim (akvam), kayme, kayyım, kayyum, kıvam, kıyam, kıyamet, kıymet, makam (kaymakam), mukavemet (mukavim), takvim, ikamet (mukim), ikametgâh <br><br> İbr/Aram #ḳym (yeminli sözleşme, ant)","","kalk","stand"
14,"نعم","nEm","Root","to lead an easy life, enjoy the comforts and conveniences of life, be joyful, comforts/delights, become easy/soft/plentiful/pleasant/good/flourishing, to knead/cook well. in'aam - beneficence, favour to a person, blessing, gifted (with speech/talent/reason etc).","","naim","favor"
15,"غير","gyr","Root","bring, convey, benefit, bestowed upon; alter or change a thing for the worse, corrupted, tainted, infected, render it ill-smelling; adjusting, repairing; difference between two persons; become jealous; procure; other than (exclusively), except, without; lies; [a manãs] dislike of anotherãs participation in what supposedly his right; care of what is sacred or inviolable to avoid suspicion of disdain; cognizance or badge of a free non-Muslim subjects in a Muslim government; one who puts off the furniture of his camel from off him to relieve and ease him. mughiraat - raiders.","","ve","but"
16,"غضب","gDb","Root","anger/wrath/stern, displeasure, indignation, hot tempered, passion, intense/deep redness","","gazab","wrath"
17,"ضلل","Dll","Root","Erred, strayed, or went astray. Deviated from the right way or course. Missed or lost the right way. Lost something but does not know its place. Confounded or perplexed and unable to see the right course.","","boşa","errs"
18,"كتب","ktb","Root","he wrote it, to dictate it, prescribe/appoint/ordain, judged / passed sentence / decreed, drew/brought together, collected, conjoined / bound, he sewed it, what is written (e.g. of law), mode/manner of writing, book, bookseller, a thing in which or on which one writes, record/register/writ, revealed scripture, a writer/scribe/secretary, an army/military force, troop.","","yazı","Book"
19,"ريب","ryb","Root","to make uncertain, cast one into doubt, calamity, suspicion, disturb, cause doubt, cause uneasiness of mind, cause affliction, create evil opinion, make false charge.","","şüphe","doubt"
20,"وقي","wqy","Root","to protect, save, preserve, ward off, guard against evil and calamity, be secure, take as a shield, regard the duty. muttaqii - one who guard against evil and against that which harms and injures and is regardful of his duty towards human beings and God.","","kork","fear"
21,"امن","Amn","Root","güvenli, sağlam, emin, emniyette olmak veya hissetmek; güvenlik/emniyet/selamet/güven durumu, güven, emanet; Kalpte/zihinde sessiz, sakin, huzurlu, dingin olmak; kötülük beklentisinden özgür olmak; veya beğenilmeyen bir nesneden özgür olmak; güvenlik / emniyet vaadi, güvencesi, teminatı; kendine güvenen, güven veren, güvenen hale gelmek; inanmak, kabul etmek, onaylamak <br><br> <strong>Türkçe’ye girmiş türevler:</strong> mümin, emanet, iman, aman, amenna, amentü, âmin, emin (yeddiemin), emniyet, temin, teminat, emanetçi, emaneten, şehremaneti, amanın, amanin, amansız, biaman, elaman <br><br> İbr/Aram āmēn אָמֵן emin ve sadık olma, amin deme","","iman","safe"
22,"غيب","gyb","Root","absent/remote/hidden/concealed, absent from the range or beyond the reach of perception by sense or of mental perception, unseen/invisible, slander, backbite, hidden reality, absent one.","","gayb","unseen"
23,"صلو","Slw","Root","Hayvanın arka orta bölümü, kuyruğunun çıktığı yer, sırtlamak, desteklemek, uyluklamak, yakından takip etmek, arkasından yürümek/takip etmek, (Musalli > önde giden atı izleyen arkadaki at) bağlı kalmak, söylev, nutuk, hitabe, konuşma, dua, yalvarış, istirham, rica, övgü, takdir, methiye, kutsama, lütuf, şükran","","salat","salat"
24,"رزق","rzq","Root","to provide, supply, bestow, grant, means of subsistance. turzaqan - you both shall be supplied. rizq - bounty, gift, portion/share. raziq - one who provides or supplies. razzaq -great provider/supplier.","","rızkı","provides"
25,"نفق","nfq","Root","to be saleable, to come out of a hole, be exhausted (store), consumed, spent, expenditure. To enter into another hole where there is another outlet, so is a hypocrite who professes to believe first one thing and then another, thus entering faith through one door and leaving it through another.","","verir","Spend"
26,"نزل","nzl","Root","to descend, come down, go down, happen, alight at, settle in a place, lodge. anzala - to send down, give. nazulun - that which is prepared for a guest's entertainment, abode, gift. manzil - mansion, station. nazzala - to cause to descend, send down. tanziil - sending down, divine revelation, orderly arrangement and authentic compilation, gradual revelation.","","inen","phases"
27,"قبل","qbl","Root","to accept/admit/receive/agree, meet anyone, to face/encounter someone/something, advance/approach, correspond, counteract/compare/requite/compensate, the front part (12:26), accept with approval, show favour.","","dön","before"
28,"اخر","Axr","Root","go backwards, retreat/recede/retire, hold back/delay/postpone/defer, last/back part of a thing .","","son","other"
29,"يقن","yqn","Root","certainty, surely, of a certainty, to be sure/certain/obvious, to ascertain, one who is certain.","","ölüm","certain"
30,"فلح","flH","Root","cut/slit/crack/split/fissure, furrowed/plough/cultivate, agriculture, till the ground, to prosper be successful, attain/acquire, become fortunate/happy, become independent, permanence/lastingness/duration.","","iflah","succeed"
31,"كفر","kfr","Root","Gizlemek, örtmek, reddetmek, inanmamak, müteşekkir olmamak, şükran duymamak, nankörlük etmek, tanımamak, inkar, imansız, siyah at, karanlık gece, ekici / çiftçi.<br> [[Belki de, kelimenin birincil anlamının, aktif ve bilinçli bir niyetle gizlemek, üstünü örtmek (çiftçilikteki gibi) olduğu dikkate alınmalıdır. Bu da şunu doğurur: bir insanın kendi bilinçli/şuurlu kararıyla bir şeyi reddedip inanmaması. Bir şeyin reddedilebilmesi için önce o şeyin duyulması/görülmesi/deneyimlenmesi gerektiğini lütfen unutmayınız.]] <br><br><strong>Türkçe’ye girmiş türevler : </strong>kâfir, küfür, kefere, küffar, tekfir, kefaret <br><br>Aram #kpr (1. örtme, gizleme, 2. nimeti inkâr etme)","","inkar","deny"
32,"سوي","swy","Root","","","düz","even"
33,"نذر","npr","Root","to dedicate, make a vow, warn, admonish, caution, promise voluntarily, offer present. nadhiir - warner, one who informs and averts calamity, who cautions and put one on guard.","","uyar","Warn"
34,"ختم","xtm","Root","To seal/stamp/imprint/impress, to secure/protect oneself against a thing, produce an impression or effect upon a thing, reach the end of a thing, cover over a thing, turn away/avoid/shun someone or something, to not understand, prevent the heart from believing, feign heedlessness.","","mühürlü","sealed"
35,"قلب","qlb","Root","","","kalb","heart"
36,"سمع","smE","Root","","","kulak","hear"
37,"بصر","bSr","Root","","","göz","see"
38,"غشو","g$w","Root","","","sarar","faints"
39,"عذب","Epb","Root","cezalandırma, azarlamak, ceza, işkence, acı, eziyet, sıkıntı, ağır ceza, kaçınmak/vazgeçmek, bir haktan vazgeçmek, feragat etmek, çıkmak, engel olmak zorluk çıkarmak. Bir şey inkar etmek, biri tarafından konulan engel, erişilemez olmak, önlemek. <b>adhb</b> - lezzetli, tatlı (genellikle su), ör: 25:23, 35:12 <br><br><strong>Türkçe’ye girmiş türevler : </strong>azap, muzip, tazip (muazzep)","","azab","torment"
40,"عظم","EZm","Root","great, important, big, regard, honour, mighty, glorious, a man of moment, All-mighty, All-glorious, grievous, bounty/abounding, magnify/increase. azzama - to make great.","","ulu","great"
41,"نوس","nws","Root","to swing, halt in a place, move, toss. Mankind, people, others, men.","","halk","men"
42,"قول","qwl","Root","konuşmak / söylemek, çağırmak, iletmek, nakletmek, düşünmek, ilan etmek, görüş yaymak, bir durumu, şartı ya da vaziyeti göstermek. kelime / konuşma, söyleyiş, söylenen şey, tebrik, söylem. <br><br><strong>Türkçe’ye girmiş türevler : </strong>kavl, kavlen, kavli, kale al-, kalubela, kaval, kilükal, makale, makule, mukavele","","de","Say"
43,"خدع","xdE","Root","To hide/conceal, double or fold, decieve or outwit, pretend, to enter, vary in state/condition, refrain or refuse, relinquish, to be in little demand of, deviate from the right course, resist/unyield/incompliant, turn away and behave proudly.","","aldatamazlar","deceive you"
44,"نفس","nfs","Root","was or became high in estimation, of high account or excellent, highly prized/precious/valuable and therefore desired with much emulation or much request, desired, it became loved or highly esteemed, console, cheer, envy.","","can","soul"
45,"شعر","$Er","Root","to know/perceive/understand, to acquaint, perceive by senses.","","şiir","A poet"
46,"مرض","mrD","Root","To be diseased/disordered, distempered, to be ill or sick, languid or weak or feeble, deficient in strength, defective or deficient, to be right or nearly right (in judgement or opinion).","","hasta","ill"
47,"زيد","zyd","Root","increased/augmented/grew, exceeded, was/became redundant/superfluous, remain over & above, addition, exaggerate, accessory, surplus.","","daha","add"
48,"الم","Alm","Root","in pain, suffered pain, express pain/grief/sorrow, lament","","acı","painful"
49,"كون","kwn","Root","Olmak, var olmak, vuku bulmak, meydana gelmek, öyle veya böyle (olmak), kaynaklanan. <strong>makaan</strong> - taraf, yan, mesken, amaç, durum, yol, koşul, şart. <strong>makaanatun</strong> - yer, yol, amaç, niyet, koşul, şart, yetenek, beceri, yapabilirlik, olunan veya var olunan yer. <br><br><strong>Türkçe’ye girmiş türevler : </strong>mekân, mekânsal, lamekân, kâinat, tekevvün, tekvin, yekûn, topyekûn","","ve","is"
50,"كذب","kpb","Root","To lie, say what is not a fact, lie to falsely invent, tell lies about or against, fabricate a lie, relate a lie, say a falsehood, be wrong, be cut off, deceive, disappoint the expectation of.","","yalan","lie"
51,"فسد","fsd","Root","to become evil/corrupted, invalid, decomposed, bad/spoiled/tainted, wrong, vicious, make mischief or foul deal. fasad - corruption/violence.","","fesad","corruption"
52,"ارض","ArD","Root","yer, yeryüzü, ülke, toprak. En, genişlik. Dönmek, yeşerip dal budak sarmak. Verimli, bereketli, üretken, bitki yönünden bol arazi. İnişli çıkışlı hareket için yer. Oyalanmak, beklemek, ummak, sabırlı olmak. Cennetin karşıtı olarak dünya, ve yerkürenin toprak yüzeyi anlamında, üzerinde yürüdüğümüz, oturduğumuz, uzandığımız yer. İyi arazi. Kalan, sabit, yerde beklenti içinde oyalanmak. Ağır, yavaş, halsiz, eğimli, veya yere doğru eğilimli olmak. Itaatkâr. Rahat bir durumdan kaynaklanan ürperme, baş dönmesi. <br><br><strong>Türkçe’ye girmiş türevler : </strong>arz, arazi, ardiye <br><br> İbr ereṣ (a.a.). = ülke","","yer","land"
53,"صلح","SlH","Root","to be right/good/honest/upright/sound/righteous, suit, fit. aslaha - to set a thing aright, reform, do good. saalihaat - good works, fit and suiting deeds. aslaha (vb. 4) - to make whole sound, set things right, effect an agreement between, render fit. islaah - uprightness, reconciliation, amendment, reformation. muslihun - reformer, one who is upright, righteous, a person of integrity, peacemaker, suitable.","","iyi","amend"
54,"سفه","sfh","Root","","","beyinsizce","fooled"
55,"لقي","lqy","Root","To meet, meet with, encounter, find, find out a thing, see, come across, experience, suffer from, occur, undergo, endure, lean upon, recieve, come face to face, go in the direction of or towards.","","at","met"
56,"خلو","xlw","Root","To be empty/vacant/void/destitute/unoccupied, to be free from fault or a thing or affair, free of accusation or suspicion, to be alone or without any companion, meet with one in a vacant/unoccupied place, to pass away, to dismiss, let loose or let go a thing, permit or allow a thing, to forsake/relinquish/desert/abandon a thing, to be distant/remote/aloof/far from a thing, be at leisure, unoccupied (unemployed).","","geçen","past"
57,"شطن","$Tn","Root","become distant/far/remote, enter firmly / become firmly fixed therein / penetrate and be concealed, turn away in opposition (from direction/aim), devil, one excessively proud/corrupt, unbelieving/rebellious/insolent/audacious/obstinate/perverse, rope, deep curved well, it burned, became burnt, serpent, any blameable faculty or power of a man.","","şeytan","devil"
58,"هزا","hzA","Root","to bring down disgrace upon, send down contempt. To mock/ridicule/deride/laugh. (e.g. huzuwan, 2:67) .","","alay","mock"
59,"مدد","mdd","Root","to draw a thing (namely a rope), pull a thing, stretch a thing, strain a thing, extend by drawing or pulling, stretch forth, to prolong, expand/elongate/lengthen a thing, spread or spread out, delay or defer a thing, continue a thing, to help or aid someone, to advance, to increase, to supply ink (put ink into a thing), apply ink to a thing, manure land (with dung).","","dikme","ink"
60,"طغي","Tgy","Root","exceed a limit, to transgress, wander from its orbit, exceed the bound, wayward, to rise high, to overflow, to rage, go astray, deviate, be incurious, mischievous, impious, tyrannical, inordinate, rebellious, exorbitant, exceedingly wicked, insolence, injustice, infidelity, rebellion, storm of thunder & lightning of extreme severity, outburst, powers of evil, lead to evil, be overbold, contumacy, extravagantly disobedient, immoderate, corrupt, top or upper part of a mountain, idol/demon, source of wickedness.","","azdı","transgress"
61,"عمه","Emh","Root","to be confounded/perplexed/confused, wander blindly, stumble to and fro, unable to find the right course, mental blindness.","","bocalamaya","wander blindly"
62,"شري","$ry","Root","to buy/sell/barter/purchase, conclude a sale, give or take in exchange, refuse, choose, prefer, give up anything and take another, lay hold on another.","","satar","sell"
63,"ربح","rbH","Root","to gain, be successful or profitable (e.g. in trade).","","kâr","profited"
64,"تجر","tjr","Root","to traffic/trade, be in business, commerce, merchandise, dealt, sold & bought, employed property for the purpose of gain.","","ticaret","trade"
65,"مثل","mvl","Root","Stand erect, mutilate or castrate (namely a sheep or goat), to set up a thing, affect to be like or to imitate a thing, apply a proverb, apply a thing proverbially, be nearly in a sound or healthy state, near to convalescence, obey/follow a command or order, to resemble, be of likeness or equivalent.","","gibi","like"
66,"وقد","wqd","Root","to set fire, kindle, light fire.","","yakan","ignite"
67,"نور","nwr","Root","fire, flame, heat, war, light, shine, sparkle, irritate, vex or provoke war.","","nur","fire"
68,"ضوا","DwA","Root","Brought to light, made visible, discovered, or revealed. One who stood in the dark to see people by the light of their fire, without their seeing him.","","ışık","glow"
69,"حول","Hwl","Root","To be changed, come in between, pass by. To be altered or transmuted or changed, to shift or turn from one thing to another, to be shifted or transferred, to move or remove, to become crooked or uneven, shift from one's way or direction or manner, shift or move from one's place, to be shifted or moved to another place, to withdraw or recede from a covenant/compact/agreement/engagement, leap and seat oneself firmly on the back of his beast or horse, to pass, to revolve and pass, become complete, intervene as a seperation/partition/fence/barrier/obstacle/obstruction, to intervene and prevent conjunction or communication, to pour out or forth, make or pronounce a thing to be absurd/inconsistent/self-contradictory/unreal/impossible, to desire or seek a thing using skill/management/blandishment/artifice, seek or endevour a person to do a thing, almost congealed or freezing, look sharply or intently or cast ones eyes on a person, to strike or desire to strike a person with a whip, reckon a person, esteem a person weak, practice evasion or elusion, practice artifice or artful contrivance or device against a person, to trick or plot, practice strategem.","","girer","plan"
70,"ذهب","phb","Root","to go, go away, depart, take away or go away with, consume, receive, pass along, die, be ended.","","git","Go"
71,"ترك","trk","Root","To leave off, leave alone, abandon/desert/relinquish/quit, forsake, give up anything, neglect, omit, bequeath anything to anyone.","","ve bırak","he left"
72,"ظلم","Zlm","Root","","","zulm","wrong"
73,"صمم","Smm","Root","to be deaf, cork (a bottle), stop (a flask), be obstructed (ear-hole).","","sağır","deaf"
74,"بكم","bkm","Root","dumb (either by natural conformation or from an inability to find words to express himself), no understanding to reply, no ability to frame speech well though possessing the faculty of speech, refrain/cease speaking intentionally or from ignorance, impeded speech, unable to speak freely.","","ve dilsiz","dumb"
75,"عمي","Emy","Root","to swerve from duty, stray from the right course, be or become blind, ignorant, obscure and dubious, deprive of the sight, rend abstruse, blind, dark, conceal. amaha - mental blindness, amaya - mental and physical blindness.","","kör","blind"
76,"رجع","rjE","Root","to return, turn back, turn off, (blame) upon any one, come back, repeat, answer, bring answer, be brought back. raji'un - one who returns. murji'un - return, termination. taraja'a (vb. 6) -to return to one another.","","dön","return"
77,"صوب","Swb","Root","to pour forth, hit the mark, come down. asaaba - to overtake, happen to, befall, fall upon, will, affect injuriously, meet with, send down, pour down upon, afflict or punish, intend, desire. sawaabun - that which is right, straight forward course, rightness. musiibun - that which happens. musiibatun - calamity.","","verir","befell"
