rootId:ID,root,transliteration,:LABEL,descriptionTr,descriptionEn,translationTr,translationEn
1069,"وكا","wkA","Root","to recline.","","yaslanarak","I lean"
1070,"حوش","Hw$","Root","To beat for game, glorify, frighten. To come around the chase or game to turn it towards the snare, to hunt or catch the chase or game, scare the chase or game towards oneself, drive along the sheep or goats, collect together and drive camels, collect or draw a thing together, consume a thing from the sides, to turn aside from a place or thing, to circumvent someone, endeavour to induce someone to turn or incline or decline, endeavour to turn someone by deceit or guile, delude a person, act towards a person with artifice, to excite/incite/urge/instigate a person to do a thing, remove/withdraw/retire to a distance, to be forlorn of a person, to feel or have a sense of or move with shame/shyness/bashfulness, take fright and flee from a person, to be averse or shrink from a person, moved by a person, to be or become scared, encompass or surround the chase or game.","","haşa","Forbid"
1071,"صبو","Sbw","Root","","","kayarım","a child"
1072,"خبز","xbz","Root","To feed with bread, to make or knead bread, he beat him or it.","","ekmek","bread"
1073,"سمن","smn","Root","","","semiz","fat"
1074,"عجف","Ejf","Root","to become lean, emaciate (animal).","","zayıf inek","lean ones"
1075,"ضغث","Dgv","Root","Collected, confused or confounded. Washed without cleansing. Felt (for a certain purpose). Complications.","","karmakarışık","a bunch"
1076,"غيث","gyv","Root","","","yağmuru","the rain"
1077,"بول","bwl","Root","mind/heart, to move/occur to my mind/heart, state/condition/case for one which cares, easy/pleasant condition, attention, origin.","","hali","(is the) case"
1078,"حصحص","HSHS","Root","To be quick in going or journeying or in pace, to be removed or stripped off, to strive or labour, exert oneself, take extraordinary pains, exceed the usual bounds, to be established/distinct/apparent/manifest.","","yerini buldu","(is) manifest"
1079,"جهز","jhz","Root","To equip or furnish, to supply or provide, to prepare, to despatch, to hasten and complete, to fit out.","","yükletti","with their supplies"
1080,"رحل","rHl","Root","to depart, saddle-bag, he saddled the camel, he bound upon the camel, to mount, rode, pack, caravan, remove/travel/journey.","","yükünün","the bag"
1081,"مير","myr","Root","To bring or convey, purvey, bring a thing to someone, give to someone.","","yine yiyecek getiririz","And we will get provision"
1082,"بعر","bEr","Root","camel.","","bir deve","(of) a camel"
1083,"حوج","Hwj","Root","To desire, be in want of, need, require, to find it necessary to do or that one should do a thing, to seek or seek after, to be poor or in poverty (out of want or need), to lead one or oneself aside, forsake one's own way, incline to a person.","","arzuya","a need"
1084,"عير","Eyr","Root","to wander, go backwards and forwards. irun - caravan, caravan of camels carrying corn.","","kervan","the caravan"
1085,"فقد","fqd","Root","to loose, want, miss, be depressed of. tafaqqada - to review, make an inquisition into, search out things lost or missed.","","kaybettik","you miss"
1086,"صوع","SwE","Root","to measure, measuring vessel.","","su tasını","(the) cup"
1087,"وعي","wEy","Root","to preserve in the memory, keep in mind, retain, contain, collect, understand, learn, pay attention, recover ones senses, store up.","","yükünden","(the) bag"
1088,"برح","brH","Root","go away, depart, withdraw, to give up or leave/cease/quit, angry, annoy/distress/difficulty/adversity, hurt/fatigue.","","durmayacağım","I will cease"
1089,"فتا","ftA","Root","to cease from, forget, break, desist (it is always used in a negative sense).","","sen hâlâ","you will not cease"
1090,"شكو","$kw","Root","to complain/accuse, bewail. ashka - to listen to the complaint, remove the cause of complaint, satisfy the complaint of anyone by. shakwatun - small water-skin, pillar on which a lamp is put. ishtakaa - to make a complaint. mishkaat - niche for a lamp in the wall, pillar on which a lamp is put.","","arz ederim","I complain"
1091,"زجو","zjw","Root","to drive, to urge on, become in a right state, It (a bad piece of money) passed or had currency, it was or became easy of collection, the acting with penetrative energy and effectiveness in an affair, effect/accomplish it, pushed it gently so it may go on, a small or scanty thing that may be pushed or driven away because of the little account that is made of it, paltry, weak.","","sürer","drives"
1092,"ثرب","vrb","Root","reproach, blame, find fault with.","","kınama","blame"
1093,"فند","fnd","Root","lie, utter a falsehood, to err or make a mistake, weak in judgement, unsound in mind, lack in ability, dotard.","","bana bunak demezseniz","you think me weakened in mind"
1094,"صنو","Snw","Root","a palm or other tree springing from the same root as others. Water, stones between two mountains. sinwan - one of the pair or more than two intertwined trees, trees growing in clusters from one root. Related family members.","","çatalı","trees (growing) from a single root"
1095,"جدد","jdd","Root","To cut off a thing, to be new, to become fortunate or possessed of good fortune, to be great or of great dignity or estimation, to be serious or in earnest, to strive/labour/toil/exert oneself, to feel distressed or afflicted, to drip or let fall drops (a house or tent, Bayt), make [or weave] stripes of different colors in a garment, to contend with another respecting a thing, relinquish or forsake, to originate or innovate a thing, to do a thing for the first time, to renew a thing, to be easy or practical, hard or level (like a ground free of soft spaces and clear to one's view), ascend upon the surface of the ground, to be lost or devoid of something, one's lot in life or means of subsistence, state of being in no need or having no wants or having few wants, to be great/exalted/majestic, to be or have much (abounding with a thing), to be of a great or extraordinary degree, to differ from the rest of something [and, thus, serve as a sign or mark] such as a beaten path marked with lines [cut by the feet of men and beast who travelled along it], to perform an affair by a certain way or manner, to form an opinion respecting a thing, to be renewed or replaced by new, to be cut off by the roots or eradicated, to be quick in pace.","","şanı","new"
1096,"سرب","srb","Root","","","sıyrılıp","a mirage"
1097,"محل","mHl","Root","To labour skillfully, excercise art or management.","","tuzağı (cezası)","(in) Strength"
1098,"سيل","syl","Root","","","sel","and flows"
1099,"زبد","zbd","Root","fresh butter, froth/foam/spume/scum, state of commotion of a liquid (e.g. water in a cooking pot), a tumultuous/frothing sea, blossomed, become intensely white.","","köpük","a foam"
1100,"جفا","jfA","Root","To cast forth foam or scum, to throw or heave, cast froth, to be worthless or useless.","","yok olup","(as) scum"
1101,"مكث","mkv","Root","To tarry, to tarry and wait/expect, to loiter, to stay, pause in expectation, to not haste, be slow of speech.","","kalır","remains"
1102,"قرع","qrE","Root","to knock, strike, beat, hit the butt, gnash (the teeth), strike with severity. qari'atun - great calamity that destroys a nation, adversity that comes suddenly, a name of the day of resurrection, great abuse.","","bir bela","a disaster"
1103,"محو","mHw","Root","To efface or erase a thing, to obliterate/cancel/remove/do away with a thing, to dispell a thing.","","siler","Then We erased"
1104,"جرع","jrE","Root","To swallow, swallow it (water) at once, drink or sip little by little, repress or restrain wrath or rage.","","onu yutmağa çalışır","He will sip it"
1105,"سوغ","swg","Root","","","lezzetli","pleasant"
1106,"رمد","rmd","Root","to starve from cold, destroy, put in ashes, become dirty. ramad (pl. of armidatun) - ashes, fine and copious ashes","","küle benzer","(are) like ashes"
1107,"جزع","jzE","Root","To cut or cut off, to be impatient, manifest/show/display grief or agitation, display violent grief, break off or in half or in portions.","","sızlanır","distressed"
1108,"صرخ","Srx","Root","to cry out loudly, cry/implore for help/assistance, shout for succour.","","imdad (eden)","will cry"
1109,"فرع","frE","Root","to ascend, go down, overtop, surpass, branch, top of a tree, sprout, hair, consequence of a principle. Appellation of the ancient kings of Egypt and not the name of a particular king.","","ve dalları","and its branches"
1110,"جثث","jvv","Root","To pull up or pull out, cut or cut off, to uproot, to eradicate.","","gövdesi koparılmış","uprooted"
1111,"بور","bwr","Root","perished, become extinct, destroyed, become bad/corrupted, destructive, in a state of perdition/detriment/deficiency, ineffectual, stagnant/dull, not sought/desired.","","helak","ruined"
1112,"حصي","HSy","Root","Calculate, to count/number. To strike with a pebble. To deny or refuse, cast a pebble or small stone at a person, to smite a person or thing with a pebble or small stone, to have a stone in one's bladder or kidneys, to have a hardening of the urine in the bladder (so that it becomes like a pebble or small stone), to number/count/calculate/count/compute a thing, to reckon a thing, reach the last number of a thing, collect into an aggregate by numbering, retain a thing in the memory, understand a thing, register/record the number of a thing, comprehend or know a thing altogether.","","ve sayın","you count it"
1113,"شخص","$xS","Root","to be raised up, fixed (the eyes) in horror, fixedly stare (in horror).","","donup kalır","will stare"
1114,"هطع","hTE","Root","to hasten forward, go along fearfully in looking fixedly at a point. ahta'a - to walk fast while stretching the neck (camel).","","koşarlar","Racing ahead"
1115,"قنع","qnE","Root","to be content, satisfied with what is within one's approach, not looking for more, beg with some reservation, beseech earnestly. qani'un (pl. qunna'un) - one who is deserving charity but does not beg, content. muqni'un (vb. 4) - one who lifts up the head. aqna'a - to raise (the head), outstretched neck.","","dikerek","raised up"
1116,"زول","zwl","Root","it went away, passed away, departed/removed/shifted, ceased to exist, came to naught, become remote, to turn/swerve, quit, motion/commotion.","","zeval","end"
1117,"صفد","Sfd","Root","to bind, fetter, chains, favour or gift bestowed on someone because it binds the receiver to the giver.","","zincirler","chains"
1118,"سربل","srbl","Root","","","elbiseler","garments"
1119,"قطر","qTr","Root","to drop, drip (liquid). taqattara - to fall on the side. taqatara - to walk side by side. aqtar (pl. of qutrun) - sides, regions. qitran - molten copper, liquid pitch.","","katran","tar"
1120,"امل","Aml","Root","hoped for it, expect, distant or remote expectation, clinging of the heart to the coming to pass of a future desired event, affection of the heart for some good to be attained, in respect of hope","","arzu","the hope"
1121,"سلك","slk","Root","","","sok","Insert"
1122,"عرج","Erj","Root","to ascend/mount. To limp, be lame.","","çıkar","Ascend"
1123,"شهب","$hb","Root","to burn/scorch, become of a colour in which whiteness predominates over blackness. shihaab (pl. shuhub) - flaming fire, bright blaze/meteor, star, penetrating flame, shining star, brisk/sprightly, flame, brand, radiating or gleaming fire, shooting or falling star. shihaab al-herb - dauntless warrior, one who is penetrating sharp and energetic in war.","","bir alev","a torch"
1124,"لقح","lqH","Root","To impregnate, vaccinate, fertilize, conceive, receive, fecundation.","","aşılayıcı olarak","fertilizing"
1125,"صلصل","SlSl","Root","to resound, clash, be dried up, emit a sound. sallatun - sound, clank, dry earth. salsaal - dry ringing clay, sounding/dried clay.","","bir çamur-","clay"
1126,"حما","HmA","Root","Black and fetid mud, to cleanse the well of it [black, fetid mud], to be mixed with black and fetid mud, to be rendered turbid and altered in odour, to be angry with someone, paternal uncle, a certain plant that grows in Nejd in the sands or in the plain and soft land, a man of an evil eye, to injure with the evil eye.","","balçık-","black mud"
1127,"قنط","qnT","Root","to despair, lose courage, hinder, abandon hope.","","umut keser","despair"
1128,"فضح","fDH","Root","expose vices/faults or evil qualities/actions, to disgrace, put to shame, the daybreak/dawn because it exposes everything, white but not intensely so.","","beni mahcubetmeyin","shame me"
1129,"وسم","wsm","Root","to brand/stamp/mark/impress/depict.","","işaretten anlayanlara","We will brand him"
1130,"خفض","xfD","Root","To lower or depress, to abase, to overcome, to be easy/tranquil/gentle, to have a tranquil/easy and plentiful life, to be soft or gentle in voice.","","ve indir","And lower"
1131,"عضو","EDw","Root","to divide into parts, separate parts, bits, enchantments, lies, slanders.","","bölük bölük","(in) parts"
1132,"صدع","SdE","Root","to split, expound, cleave, profess openly, divide, cross, proclaim, promulgate aloud, declare openly, be affected with headache, manifest, make clear. sad'un - fissure. suddi'a - to oppress with or suffer from headache. issada'a (vb. 5) - to be split up or divided. mutasaddiun - that which is cloven or splits in two.","","çatlayan","So proclaim"
1133,"نطف","nTf","Root","to flow gently, extrude, ooze, exude, drop, pour, trickle.","","nutfe-","a semen-drop"
1134,"دفا","dfA","Root","to be or keep warm, be hot.","","ısınma","(is) warmth"
1135,"بغل","bgl","Root","","","ve katırları","and mules"
1136,"طرو","Trw","Root","","","taze","fresh"
1137,"مخر","mxr","Root","To cleave, to run and cleave a thing with a noise, to make a noise or sound, advance and retire, face or turn towards the wind, plough through.","","(denizi) yarıp gittiğini","cleaving"
1138,"سقف","sqf","Root","","","tavan","roofs"
1139,"خسف","xsf","Root","To sink or go away into the ground or earth (place or person), become depressed (such as the eye becoming depressed in the head), to lose sight/become blind, to lose light (like the sun or moon during an eclipse), become defective or deficient, become lean or emaciated, to recover (such as from disease or illness), to put out one's eye, make a hole in a thing, to abase or humble or make lowly, to disgrace, to be vile.","","batırdık","Allah will cave"
1140,"دخر","dxr","Root","To be small, mean, lowly, of no value or account, abject, humbled.","","sürünerek","humbled"
1141,"وصب","wSb","Root","to be perpetual, incumbent, be firm, last, continue.","","daima","perpetual"
1142,"جار","jAr","Root","raised his voice in prayer/supplication , he humbled/abased himself with earnest supplication to God, Cried out/called for aid/succour","","yalvarırsınız","cry for help"
1143,"دسس","dss","Root","To hide, bury, conceal, insinuate, thrust.","","onu gömsün mü?","bury it"
1144,"فرث","frv","Root","to let out the contents, scatter and give out, to feel heaving in the stomach, contents of stomach, filth, dung, faeces.","","fışkı","bowels"
1145,"لبن","lbn","Root","milk","","süt","milk"
1146,"حفد","Hfd","Root","To do a thing speedily, minister, be nimble in work, to be continuous in course or pace, to be active or agile in doing a thing, to serve and work, to labour, to assist/help. Hafadatun grandsons; grandchildren; daughters.","","ve torunlar","and grandsons"
1147,"لمح","lmH","Root","To shine, glister, give a glance with the eye, twinkling (of an eye).","","açıp yumma gibidir","as a twinkling"
1148,"جوو","jww","Root","Signifies the air or atmosphere between the sky (or heaven) and the earth, the region between the heaven/sky and the earth, wide part of a valley, the inside or interior, inner/inward/secret/private.","","boşluğunda","the midst"
1149,"ظعن","ZEn","Root","went away, departure, migration, journey/travel, march, remove, leave a place, move from one place to another.","","göç","(of) your travel"
1150,"صوف","Swf","Root","to wear wool, wool-fleece.","","yünlerinden","their wool"
1151,"وبر","wbr","Root","to have soft hair, stay in a place.","","ve yapağılarından","and their fur"
1152,"اثث","Avv","Root","to be luxuriated, close, become much in quantity, abundant, numerous, great, thick or large. athaathan - goods, utensils, household furniture, moveable goods, all property consisting of camels/sheep/goats and abandoned property.","","eşyaca","(is) furnishing"
1153,"عتب","Etb","Root","to be angry, blame. ist'ataba (vb. 10) - to seek to remove; blame, seek favour/pleasure, please, be allowed to make amends for his sins, accept any excuse in defence, take favour, be allowed to approach the threshold, be given leave to seek pleasure of, regard with favours, grant goodwill. a'taba - to satisfy. ta'attab - to accuse anyone of a blameworthy action. atabatun - threshold, hold of a door, step of a ladder, ascent of hill. utba - favour granted. itab - blame, reproof, complaint, charge.","","affedilenler-","they ask for favor"
1154,"وكد","wkd","Root","to confirm, assert, affirm, ratify.","","pekiştirdikten","their confirmation"
1155,"غزل","gzl","Root","to spin, spun the cotton or wool, became remiss, became confounded with a young gazelle; he talked with her and acted in an amatory and enticing manner; turned around or made to revolve; attempted as a self-imposed task; follower of, lover of; amorous or enticing gestures or manners; the sun when high or rising; a vender or spinner of thread; a slender cord","","ipliğini","her spun yarn"
1156,"نفد","nfd","Root","to vanish, fail, cease, pass away, be exhausted, consumed, spent.","","tükenir","depletion"
1157,"عجم","Ejm","Root","to chew, try by biting. a'jama - to speak Arabic imperfectly, abstruse (language). a'jamiyyun - foreign, non-Arab, one who has an impediment in speech. a'jamiyyan - foreign tongue. a'jamina - non-Arabs.","","yabancılardan","(is) foreign"
1158,"جوس","jws","Root","To seek for or seek after, go to and fro (going and coming), trod upon, enter, come into one's midst.","","(sizi) araştırdılar","and they entered"
1159,"نشر","n$r","Root","to spread out, bring back to life, resuscitate, be extended, lay open, unfold, expand, display, spread abroad.","","dönüş","unrolled"
1160,"حظر","HZr","Root","To prevent, restrain, forbid, confine, limit, restrict, enclose, make a limit of seperation, protect or defend oneself by means of a person or thing.","","ağıldaki","restricted"
1161,"كلو","klw","Root","","","her iki","Each"
1162,"افف","Aff","Root","expression of anxiety/distress/disgust, anything people deem troublesome/displeasing/hateful","","öf","Uff"
1163,"بذر","bpr","Root","scatter/disperse, (e.g. sowed seed, cast grain), diffused/disseminated, divulge/reveal, extravagant in expenditure, babbling, dissipated/squandered, destroyed/consumed/wasted/ruined, frivolous, false/vain/ineffectual, many/much/abundant/plenty/increase.","","savurarak","spend"
1164,"زني","zny","Root","to mount, the mounting upon a thing, to commit fornication/adultery, fornicator/adulterer.","","zinaya","adultery"
1165,"قسطس","qsTs","Root","balance/scale.","","terazi ile","with a balance"
1166,"مرح","mrH","Root","To be weak, to leak or let flow water or tears, to be joyful or glad, rejoice above measure (excessively/exceedingly), proud and self-conceited, behave unthankfully or ungratefully.","","böbürlenmiş","exultantly"
1167,"ستر","str","Root","","","gizli","hidden"
1168,"رفت","rft","Root","to be broken, cut, be crushed, be broken in pieces (bones), be crumbled, be bruised/pounded. rufat - dust, broken particles of dust, crumbs, decayed bones, anything broken small or crushed to pieces and fragments.","","ve ufalanmış toprak","and crumbled particles"
1169,"نغض","ngD","Root","to move the head to another person as amazed, be wonder-struck, wag (the heads), expressing wonder and disbelief.","","alaylı alaylı sallayacaklar","Then they will shake"
1170,"حنك","Hnk","Root","To put a bit or bridle upon (a horse), put a rope in the mouth of a horse to lead him with, bring into subjection, destroy, bring under one's authority, fasten, take the whole of ones property, gain mastery over a thing, turn someone back or away from an affair, overturn, sweep away, cause to perish, firm or sound in judgement due to experience or age, understand and know a thing thoroughly, eat/devour/consume/chew.","","hakimiyetime alacağım","I will surely destroy"
1171,"وفر","wfr","Root","to be plentiful, copious/numerous/ample, increase.","","mükemmel","ample"
1172,"فزز","fzz","Root","to remove, provoke, expel, unsettle, be scared away from, turn away, startle. istafazza (vb. 10) - to excite, make active, deceive, unsettle, remove, expel, lead to destruction, make weak by humiliating, entail loss of right of citizenship.","","yerinden oynat","And incite"
1173,"صوت","Swt","Root","to emit a sound, utter a cry. saut (pl. aswat) - voice, sound.","","sesler","the voices"
1174,"جلب","jlb","Root","To drive/bring/convey/transport, to draw/attract/procure a thing, gain or earn, seek after or seek to gain, to raise cries/shouts/noises, chide or urge on, to threaten, bring together/assemble/gather/collect, commit a crime or offence, to heal, to help/aid or assist, take or borrow, to seek or demand, to cover or clad oneself.","","örtülerini","and assault"
1175,"حصب","HSb","Root","To throw pebbles at, scatter gravel/pebbles, cast/throw into the fire, hasten from a person or thing, turn away from a person, kindle a fire. Firewood, stones.","","odunusunuz","(are) firewood"
1176,"تور","twr","Root","For dara, with the change of ta with dal: To go round, flow, ran, repeat (an action).","","bir kez daha","time"
1177,"قصف","qSf","Root","to roar and resound (thunder), rumble. qasifun - heavy gale of wind, hurricane, fierce storm, raging tempest.","","bir fırtına","a hurricane"
1178,"دلك","dlk","Root","rubbing, squeezing, pressing, decline, sinking, become red, set, incline downwards from the meridian (sun). The whole phrase ""duluk-as-shams"" defined as ""sunset"" by Lane.","","sarkmasından","at the decline"
1179,"غسق","gsq","Root","darkness, the night; become obscure, shed tears, poured water; ice-cold darkness, intense coldness; watery/thick purulent matter that flows or drips, dark/murky/cold fluid.","","ve irin","and purulence"
1180,"هجد","hjd","Root","to sleep watch, remain awake. hajjada - to awake from sleep, pray in the night. ahjad - to lay the neck upon the ground (camel). tohajjad - remain awake.","","teheccut et","arise from sleep"
1181,"شكل","$kl","Root","to mark, fashion, shackle. shakilatun - likeness, mode, way, manner, disposition, rule of conduct, fashion, peculiar manner. shakl - similitude/likeness.","","kendi karakteri","its type"
1182,"نبع","nbE","Root","to spring, gush/issue forth, flow out, emerge.","","bir göze","a spring"
1183,"كسف","ksf","Root","fragments, pieces, lumps, to shatter, to make into fragments","","parçalar","fragments"
1184,"رقي","rqy","Root","to ascend, rise gradually, mount a ladder. mirqat - stair, ladder, stepping-stone, ascent. raqin - physician, charmer. taraqiya (pl. of tarquwutun) - collar bone(s), throat, clavicle (according to some its root is raqawa or tarqawa).","","çıkmalısın","you ascend"
1185,"خبو","xbw","Root","To subside, abate, die down, fade out, decline, decrease. To be extinguished/extinct/allayed/appeased.","","(ateş) dindiği","it subsides"
1186,"تسع","tsE","Root","To be the ninth, nine.","","dokuz","nine"
1187,"ثبر","vbr","Root","to keep back, confine/limit/prevent/withhold/restrain/hinder, to deny/prohibit/refuse, render unsuccessful, to prevent one from doing or attaining something, go astray, lose, perish/destroy, disappoint, expel, curse. To work at something diligently/constantly.","","ölümü","(for) destruction"
1188,"لفف","lff","Root","To roll up, fold, wrap, involve, conjoin, be entangled (trees), be heaped, joined thick/dense and luxuriant/abundant.","","bir araya","And is wound"
1189,"ذقن","pqn","Root","to strike on the chin, lean the chin upon (with ala), chin, although its primary meaning is chin it may be rendered as face.","","çeneleri üstüne","the chins"
1190,"خفت","xft","Root","To be still or silent, to be low/soft/gentle, to be weak due to vehement hunger, to be abject, to silence or kill (smite with a sword or the like), to be goodly or beautiful, worthy of notice.","","pek de gizleme","be silent"
1191,"بخع","bxE","Root","kill oneself with grief/wrath/rage, exceed the ordinary bounds in subduing and abasing themselves by obedience, doing anything to a great extent, in great degree, egregiously or with much energy and effectiveness, consume/torment oneself.","","helak edeceksin","(would) kill"
1192,"جرز","jrz","Root","To cut or cut off, destroy or exterminate, to slay, to eat quickly or eat much, to be or become barren, to be lean or emaciated, to be dried up and without herbage.","","kupkuru","barren"
1193,"كهف","khf","Root","To fill caves or places of protection.","","Kehf","the cave"
1194,"رقم","rqm","Root","to write, stripe, brand. raqim - inscription, writing. marqum - written one.","","yazılmış","written"
1195,"شطط","$TT","Root","to be far off, wrong anyone, treat with injustice, go beyond due bounds. shattan - extravagant lie, exceeding, redundant, excess. ashatta (vb. 4) - to act unjustly.","","saçma sapan","be unjust"
